Sheet: Sheet1
A1: head | B1: 2 | C1: A列とB列を無視する指示
C3: struct | D3: DOSHeader
A4: =R[-1]C+R[-1]C[1] -> 0 | B4: 1 | C4: byte | D4: signature1 | E4: 'M'
A5: =R[-1]C+R[-1]C[1] -> 1 | B5: 1 | C5: byte | D5: signature2 | E5: 'Z'
A6: =R[-1]C+R[-1]C[1] -> 2 | B6: 2 | C6: ushort | D6: bytes_in_last_block | E6: 0x90
A7: =R[-1]C+R[-1]C[1] -> 4 | B7: 2 | C7: ushort | D7: blocks_in_file | E7: 3
A8: =R[-1]C+R[-1]C[1] -> 6 | B8: 2 | C8: ushort | D8: num_relocs | E8: 0
A9: =R[-1]C+R[-1]C[1] -> 8 | B9: 2 | C9: ushort | D9: header_paragraphs | E9: 4
A10: =R[-1]C+R[-1]C[1] -> 10 | B10: 2 | C10: ushort | D10: min_extra_paragraphs | E10: 0
A11: =R[-1]C+R[-1]C[1] -> 12 | B11: 2 | C11: ushort | D11: max_extra_paragraphs | E11: 0xffff
A12: =R[-1]C+R[-1]C[1] -> 14 | B12: 2 | C12: ushort | D12: ss | E12: 0
A13: =R[-1]C+R[-1]C[1] -> 16 | B13: 2 | C13: ushort | D13: sp | E13: 0xb8
A14: =R[-1]C+R[-1]C[1] -> 18 | B14: 2 | C14: ushort | D14: checksum | E14: 0
A15: =R[-1]C+R[-1]C[1] -> 20 | B15: 2 | C15: ushort | D15: ip | E15: 0
A16: =R[-1]C+R[-1]C[1] -> 22 | B16: 2 | C16: ushort | D16: cs | E16: 0
A17: =R[-1]C+R[-1]C[1] -> 24 | B17: 2 | C17: ushort | D17: reloc_table_offset | E17: 0x40
A18: =R[-1]C+R[-1]C[1] -> 26 | B18: 2 | C18: ushort | D18: overlay_number | E18: 0
A19: =R[-1]C+R[-1]C[1] -> 28
C21: struct | D21: PEFileHeader
A22: =R[-1]C+R[-1]C[1] -> 0 | B22: 2 | C22: ushort | D22: Machine | E22: 0x14c
A23: =R[-1]C+R[-1]C[1] -> 2 | B23: 2 | C23: ushort | D23: NumberOfSections
A24: =R[-1]C+R[-1]C[1] -> 4 | B24: 4 | C24: uint | D24: TimeDateStamp | E24: 0
A25: =R[-1]C+R[-1]C[1] -> 8 | B25: 4 | C25: uint | D25: PointerToSymbolTable | E25: 0
A26: =R[-1]C+R[-1]C[1] -> 12 | B26: 4 | C26: uint | D26: NumberOfSymbols | E26: 0
A27: =R[-1]C+R[-1]C[1] -> 16 | B27: 2 | C27: ushort | D27: OptionalHeaderSize | E27: 0xe0
A28: =R[-1]C+R[-1]C[1] -> 18 | B28: 2 | C28: ushort | D28: Characteristics | E28: 0x10e
A29: =R[-1]C+R[-1]C[1] -> 20
C31: struct | D31: PEHeaderStandardFields
A32: =R[-1]C+R[-1]C[1] -> 0 | B32: 2 | C32: ushort | D32: Magic | E32: 0x10b
A33: =R[-1]C+R[-1]C[1] -> 2 | B33: 1 | C33: byte | D33: LMajor | E33: 6
A34: =R[-1]C+R[-1]C[1] -> 3 | B34: 1 | C34: byte | D34: LMinor | E34: 0
A35: =R[-1]C+R[-1]C[1] -> 4 | B35: 4 | C35: uint | D35: CodeSize
A36: =R[-1]C+R[-1]C[1] -> 8 | B36: 4 | C36: uint | D36: InitializedDataSize
A37: =R[-1]C+R[-1]C[1] -> 12 | B37: 4 | C37: uint | D37: UninitializedDataSize
A38: =R[-1]C+R[-1]C[1] -> 16 | B38: 4 | C38: uint | D38: EntryPoint
A39: =R[-1]C+R[-1]C[1] -> 20 | B39: 4 | C39: uint | D39: BaseOfCode
A40: =R[-1]C+R[-1]C[1] -> 24 | B40: 4 | C40: uint | D40: BaseOfData
A41: =R[-1]C+R[-1]C[1] -> 28
C43: struct | D43: PEHeaderWindowsNTSpecificFields
A44: =R[-1]C+R[-1]C[1] -> 0 | B44: 4 | C44: uint | D44: ImageBase | E44: 0x400000
A45: =R[-1]C+R[-1]C[1] -> 4 | B45: 4 | C45: uint | D45: SectionAlignment | E45: 0x2000
A46: =R[-1]C+R[-1]C[1] -> 8 | B46: 4 | C46: uint | D46: FileAlignment | E46: 0x200
A47: =R[-1]C+R[-1]C[1] -> 12 | B47: 2 | C47: ushort | D47: OSMajor | E47: 4
A48: =R[-1]C+R[-1]C[1] -> 14 | B48: 2 | C48: ushort | D48: OSMinor | E48: 0
A49: =R[-1]C+R[-1]C[1] -> 16 | B49: 2 | C49: ushort | D49: UserMajor | E49: 0
A50: =R[-1]C+R[-1]C[1] -> 18 | B50: 2 | C50: ushort | D50: UserMinor | E50: 0
A51: =R[-1]C+R[-1]C[1] -> 20 | B51: 2 | C51: ushort | D51: SubSysMajor | E51: 4
A52: =R[-1]C+R[-1]C[1] -> 22 | B52: 2 | C52: ushort | D52: SubSysMinor | E52: 0
A53: =R[-1]C+R[-1]C[1] -> 24 | B53: 4 | C53: uint | D53: Reserved | E53: 0
A54: =R[-1]C+R[-1]C[1] -> 28 | B54: 4 | C54: uint | D54: ImageSize
A55: =R[-1]C+R[-1]C[1] -> 32 | B55: 4 | C55: uint | D55: HeaderSize | E55: 0x400
A56: =R[-1]C+R[-1]C[1] -> 36 | B56: 4 | C56: uint | D56: FileChecksum | E56: 0
A57: =R[-1]C+R[-1]C[1] -> 40 | B57: 2 | C57: ushort | D57: SubSystem | E57: 3
A58: =R[-1]C+R[-1]C[1] -> 42 | B58: 2 | C58: ushort | D58: DLLFlags | E58: 0
A59: =R[-1]C+R[-1]C[1] -> 44 | B59: 4 | C59: uint | D59: StackReserveSize | E59: 0x100000
A60: =R[-1]C+R[-1]C[1] -> 48 | B60: 4 | C60: uint | D60: StackCommitSize | E60: 0x1000
A61: =R[-1]C+R[-1]C[1] -> 52 | B61: 4 | C61: uint | D61: HeapReserveSize | E61: 0x100000
A62: =R[-1]C+R[-1]C[1] -> 56 | B62: 4 | C62: uint | D62: HeapCommitSize | E62: 0x1000
A63: =R[-1]C+R[-1]C[1] -> 60 | B63: 4 | C63: uint | D63: LoaderFlags | E63: 0
A64: =R[-1]C+R[-1]C[1] -> 64 | B64: 4 | C64: uint | D64: NumberOfDataDirectories | E64: 0x10
A65: =R[-1]C+R[-1]C[1] -> 68
C67: struct | D67: PEHeaderDataDirectories
A68: =R[-1]C+R[-1]C[1] -> 0 | B68: 8 | C68: Table | D68: ExportTable
A69: =R[-1]C+R[-1]C[1] -> 8 | B69: 8 | C69: Table | D69: ImportTable
A70: =R[-1]C+R[-1]C[1] -> 16 | B70: 8 | C70: Table | D70: ResourceTable
A71: =R[-1]C+R[-1]C[1] -> 24 | B71: 8 | C71: Table | D71: ExceptionTable
A72: =R[-1]C+R[-1]C[1] -> 32 | B72: 8 | C72: Table | D72: CertificateTable
A73: =R[-1]C+R[-1]C[1] -> 40 | B73: 8 | C73: Table | D73: BaseRelocationTable
A74: =R[-1]C+R[-1]C[1] -> 48 | B74: 8 | C74: Table | D74: Debug
A75: =R[-1]C+R[-1]C[1] -> 56 | B75: 8 | C75: Table | D75: Copyright
A76: =R[-1]C+R[-1]C[1] -> 64 | B76: 8 | C76: Table | D76: GlobalPtr
A77: =R[-1]C+R[-1]C[1] -> 72 | B77: 8 | C77: Table | D77: TLSTable
A78: =R[-1]C+R[-1]C[1] -> 80 | B78: 8 | C78: Table | D78: LoadConfigTable
A79: =R[-1]C+R[-1]C[1] -> 88 | B79: 8 | C79: Table | D79: BoundImport
A80: =R[-1]C+R[-1]C[1] -> 96 | B80: 8 | C80: Table | D80: IAT
A81: =R[-1]C+R[-1]C[1] -> 104 | B81: 8 | C81: Table | D81: DelayImportDescriptor
A82: =R[-1]C+R[-1]C[1] -> 112 | B82: 8 | C82: Table | D82: CLIHeader
A83: =R[-1]C+R[-1]C[1] -> 120 | B83: 8 | C83: Table | D83: Reserved
A84: =R[-1]C+R[-1]C[1] -> 128
C86: struct | D86: SectionHeader
A87: =R[-1]C+R[-1]C[1] -> 0 | B87: 8 | C87: byte | D87: Name[8]
A88: =R[-1]C+R[-1]C[1] -> 8 | B88: 4 | C88: uint | D88: VirtualSize
A89: =R[-1]C+R[-1]C[1] -> 12 | B89: 4 | C89: uint | D89: VirtualAddress
A90: =R[-1]C+R[-1]C[1] -> 16 | B90: 4 | C90: uint | D90: SizeOfRawData | E90: 0
A91: =R[-1]C+R[-1]C[1] -> 20 | B91: 4 | C91: uint | D91: PointerToRawData | E91: 0
A92: =R[-1]C+R[-1]C[1] -> 24 | B92: 4 | C92: uint | D92: PointerToRelocations | E92: 0
A93: =R[-1]C+R[-1]C[1] -> 28 | B93: 4 | C93: uint | D93: PointerToLinenumbers | E93: 0
A94: =R[-1]C+R[-1]C[1] -> 32 | B94: 2 | C94: ushort | D94: NumberOfRelocations | E94: 0
A95: =R[-1]C+R[-1]C[1] -> 34 | B95: 2 | C95: ushort | D95: NumberOfLinenumbers | E95: 0
A96: =R[-1]C+R[-1]C[1] -> 36 | B96: 4 | C96: uint | D96: Characteristics
A97: =R[-1]C+R[-1]C[1] -> 40
C99: struct | D99: ImportTable
A100: =R[-1]C+R[-1]C[1] -> 0 | B100: 4 | C100: uint | D100: ImportLookupTable | E100: 0
A101: =R[-1]C+R[-1]C[1] -> 4 | B101: 4 | C101: uint | D101: DateTimeStamp | E101: 0
A102: =R[-1]C+R[-1]C[1] -> 8 | B102: 4 | C102: uint | D102: ForwarderChain | E102: 0
A103: =R[-1]C+R[-1]C[1] -> 12 | B103: 4 | C103: uint | D103: Name | E103: 0
A104: =R[-1]C+R[-1]C[1] -> 16 | B104: 4 | C104: uint | D104: ImportAddressTable | E104: 0
A105: =R[-1]C+R[-1]C[1] -> 20