Sheet: const
A1: const
A2: int | B2: IMAGE_FILE_RELOCS_STRIPPED | C2: 0x0001
A3: int | B3: IMAGE_FILE_EXECUTABLE_IMAGE | C3: 0x0002
A4: int | B4: IMAGE_FILE_LINE_NUMS_STRIPPED | C4: 0x0004
A5: int | B5: IMAGE_FILE_LOCAL_SYMS_STRIPPED | C5: 0x0008
A6: int | B6: IMAGE_FILE_AGGRESSIVE_WS_TRIM | C6: 0x0010
A7: int | B7: IMAGE_FILE_LARGE_ADDRESS_AWARE | C7: 0x0020
A8: int | B8: IMAGE_FILE_16BIT_MACHINE | C8: 0x0040
A9: int | B9: IMAGE_FILE_BYTES_REVERSED_LO | C9: 0x0080
A10: int | B10: IMAGE_FILE_32BIT_MACHINE | C10: 0x0100
A11: int | B11: IMAGE_FILE_DEBUG_STRIPPED | C11: 0x0200
A12: int | B12: IMAGE_FILE_REMOVABLE_RUN_FROM_SWAP | C12: 0x0400
A13: int | B13: IMAGE_FILE_SYSTEM | C13: 0x1000
A14: int | B14: IMAGE_FILE_DLL | C14: 0x2000
A15: int | B15: IMAGE_FILE_UP_SYSTEM_ONLY | C15: 0x4000
A16: int | B16: IMAGE_FILE_BYTES_REVERSED_HI | C16: 0x8000
A18: const
A19: int | B19: IMAGE_FILE_MACHINE_UNKNOWN | C19: 0x0
A20: int | B20: IMAGE_FILE_MACHINE_ALPHA | C20: 0x184
A21: int | B21: IMAGE_FILE_MACHINE_AMD64 | C21: 0x8664
A22: int | B22: IMAGE_FILE_MACHINE_ARM | C22: 0x1c0
A23: int | B23: IMAGE_FILE_MACHINE_I386 | C23: 0x14c
A24: int | B24: IMAGE_FILE_MACHINE_M68K | C24: 0x268
A25: int | B25: IMAGE_FILE_MACHINE_POWERPC | C25: 0x1f0
A26: int | B26: IMAGE_FILE_MACHINE_R10000 | C26: 0x168
A27: int | B27: IMAGE_FILE_MACHINE_R3000 | C27: 0x162
A28: int | B28: IMAGE_FILE_MACHINE_R4000 | C28: 0x166
A29: int | B29: IMAGE_FILE_MACHINE_SH3 | C29: 0x1a2
A30: int | B30: IMAGE_FILE_MACHINE_SH4 | C30: 0x1a6
A32: const
A33: int | B33: IMAGE_SUBSYSTEM_UNKNOWN | C33: 0
A34: int | B34: IMAGE_SUBSYSTEM_NATIVE | C34: 1
A35: int | B35: IMAGE_SUBSYSTEM_WINDOWS_GUI | C35: 2
A36: int | B36: IMAGE_SUBSYSTEM_WINDOWS_CUI | C36: 3
A37: int | B37: IMAGE_SUBSYSTEM_POSIX_CUI | C37: 7
A38: int | B38: IMAGE_SUBSYSTEM_WINDOWS_CE_GUI | C38: 9

Sheet: struct
A1: head | B1: 2 | F1: A列とB列を無視する
C3: struct | D3: DOSHeader
A4: =R[-1]C+R[-1]C[1] -> 0 | B4: 1 | C4: byte | D4: signature1 | E4: 'M'
A5: =R[-1]C+R[-1]C[1] -> 1 | B5: 1 | C5: byte | D5: signature2 | E5: 'Z'
A6: =R[-1]C+R[-1]C[1] -> 2 | B6: 2 | C6: ushort | D6: bytes_in_last_block | E6: 0x90
A7: =R[-1]C+R[-1]C[1] -> 4 | B7: 2 | C7: ushort | D7: blocks_in_file | E7: 3
A8: =R[-1]C+R[-1]C[1] -> 6 | B8: 2 | C8: ushort | D8: num_relocs | E8: 0
A9: =R[-1]C+R[-1]C[1] -> 8 | B9: 2 | C9: ushort | D9: header_paragraphs | E9: 4
A10: =R[-1]C+R[-1]C[1] -> 10 | B10: 2 | C10: ushort | D10: min_extra_paragraphs | E10: 0
A11: =R[-1]C+R[-1]C[1] -> 12 | B11: 2 | C11: ushort | D11: max_extra_paragraphs | E11: 0xffff
A12: =R[-1]C+R[-1]C[1] -> 14 | B12: 2 | C12: ushort | D12: ss | E12: 0
A13: =R[-1]C+R[-1]C[1] -> 16 | B13: 2 | C13: ushort | D13: sp | E13: 0xb8
A14: =R[-1]C+R[-1]C[1] -> 18 | B14: 2 | C14: ushort | D14: checksum | E14: 0
A15: =R[-1]C+R[-1]C[1] -> 20 | B15: 2 | C15: ushort | D15: ip | E15: 0
A16: =R[-1]C+R[-1]C[1] -> 22 | B16: 2 | C16: ushort | D16: cs | E16: 0
A17: =R[-1]C+R[-1]C[1] -> 24 | B17: 2 | C17: ushort | D17: reloc_table_offset | E17: 0x40
A18: =R[-1]C+R[-1]C[1] -> 26 | B18: 2 | C18: ushort | D18: overlay_number | E18: 0
A19: =R[-1]C+R[-1]C[1] -> 28
C21: struct | D21: PEFileHeader
A22: =R[-1]C+R[-1]C[1] -> 0 | B22: 2 | C22: ushort | D22: Machine | E22: 0x14c | F22: 0x1c0(ARM), 0x8664(AMD64)
A23: =R[-1]C+R[-1]C[1] -> 2 | B23: 2 | C23: ushort | D23: NumberOfSections | E23: 0 | F23: 設定必要 | G23: 2
A24: =R[-1]C+R[-1]C[1] -> 4 | B24: 4 | C24: int | D24: TimeDateStamp | E24: 0 | F24: 設定することが望ましい
A25: =R[-1]C+R[-1]C[1] -> 8 | B25: 4 | C25: int | D25: PointerToSymbolTable | E25: 0
A26: =R[-1]C+R[-1]C[1] -> 12 | B26: 4 | C26: int | D26: NumberOfSymbols | E26: 0
A27: =R[-1]C+R[-1]C[1] -> 16 | B27: 2 | C27: ushort | D27: OptionalHeaderSize | E27: 0xe0
A28: =R[-1]C+R[-1]C[1] -> 18 | B28: 2 | C28: ushort | D28: Characteristics | E28: 0x10e
A29: =R[-1]C+R[-1]C[1] -> 20
C31: struct | D31: PEHeaderStandardFields
A32: =R[-1]C+R[-1]C[1] -> 0 | B32: 2 | C32: ushort | D32: Magic | E32: 0x10b | F32: 0x20b(PE32+)
A33: =R[-1]C+R[-1]C[1] -> 2 | B33: 1 | C33: byte | D33: LMajor | E33: 6
A34: =R[-1]C+R[-1]C[1] -> 3 | B34: 1 | C34: byte | D34: LMinor | E34: 0
A35: =R[-1]C+R[-1]C[1] -> 4 | B35: 4 | C35: int | D35: CodeSize | E35: 0 | F35: 設定必要
A36: =R[-1]C+R[-1]C[1] -> 8 | B36: 4 | C36: int | D36: InitializedDataSize | E36: 0 | F36: 設定必要
A37: =R[-1]C+R[-1]C[1] -> 12 | B37: 4 | C37: int | D37: UninitializedDataSize | E37: 0 | F37: 設定必要
A38: =R[-1]C+R[-1]C[1] -> 16 | B38: 4 | C38: int | D38: EntryPoint | E38: 0 | F38: 設定必要 | G38: 0x1000
A39: =R[-1]C+R[-1]C[1] -> 20 | B39: 4 | C39: int | D39: BaseOfCode | E39: 0 | F39: 設定必要 | G39: 0x1000
A40: =R[-1]C+R[-1]C[1] -> 24 | B40: 4 | C40: int | D40: BaseOfData | E40: 0 | F40: 設定必要 | G40: 0x2000
A41: =R[-1]C+R[-1]C[1] -> 28
C43: struct | D43: PEHeaderWindowsNTSpecificFields
A44: =R[-1]C+R[-1]C[1] -> 0 | B44: 4 | C44: int | D44: ImageBase | E44: 0x400000 | F44: アーキテクチャにより設定
A45: =R[-1]C+R[-1]C[1] -> 4 | B45: 4 | C45: int | D45: SectionAlignment | E45: 0x1000
A46: =R[-1]C+R[-1]C[1] -> 8 | B46: 4 | C46: int | D46: FileAlignment | E46: 0x200
A47: =R[-1]C+R[-1]C[1] -> 12 | B47: 2 | C47: ushort | D47: OSMajor | E47: 4
A48: =R[-1]C+R[-1]C[1] -> 14 | B48: 2 | C48: ushort | D48: OSMinor | E48: 0
A49: =R[-1]C+R[-1]C[1] -> 16 | B49: 2 | C49: ushort | D49: UserMajor | E49: 0
A50: =R[-1]C+R[-1]C[1] -> 18 | B50: 2 | C50: ushort | D50: UserMinor | E50: 0
A51: =R[-1]C+R[-1]C[1] -> 20 | B51: 2 | C51: ushort | D51: SubSysMajor | E51: 4
A52: =R[-1]C+R[-1]C[1] -> 22 | B52: 2 | C52: ushort | D52: SubSysMinor | E52: 0
A53: =R[-1]C+R[-1]C[1] -> 24 | B53: 4 | C53: int | D53: Reserved | E53: 0
A54: =R[-1]C+R[-1]C[1] -> 28 | B54: 4 | C54: int | D54: ImageSize | E54: 0 | F54: 設定必要 | G54: 0x4000
A55: =R[-1]C+R[-1]C[1] -> 32 | B55: 4 | C55: int | D55: HeaderSize | E55: 0 | F55: 設定必要 | G55: 0x200
A56: =R[-1]C+R[-1]C[1] -> 36 | B56: 4 | C56: int | D56: FileChecksum | E56: 0 | F56: 設定することが望ましい
A57: =R[-1]C+R[-1]C[1] -> 40 | B57: 2 | C57: ushort | D57: SubSystem | E57: 3 | F57: WINDOWS_GUI=2
A58: =R[-1]C+R[-1]C[1] -> 42 | B58: 2 | C58: ushort | D58: DLLFlags | E58: 0
A59: =R[-1]C+R[-1]C[1] -> 44 | B59: 4 | C59: int | D59: StackReserveSize | E59: 0x100000
A60: =R[-1]C+R[-1]C[1] -> 48 | B60: 4 | C60: int | D60: StackCommitSize | E60: 0x1000
A61: =R[-1]C+R[-1]C[1] -> 52 | B61: 4 | C61: int | D61: HeapReserveSize | E61: 0x100000
A62: =R[-1]C+R[-1]C[1] -> 56 | B62: 4 | C62: int | D62: HeapCommitSize | E62: 0x1000
A63: =R[-1]C+R[-1]C[1] -> 60 | B63: 4 | C63: int | D63: LoaderFlags | E63: 0
A64: =R[-1]C+R[-1]C[1] -> 64 | B64: 4 | C64: int | D64: NumberOfDataDirectories | E64: 0x10
A65: =R[-1]C+R[-1]C[1] -> 68
C67: struct | D67: PEHeaderDataDirectories
A68: =R[-1]C+R[-1]C[1] -> 0 | B68: 4 | C68: int | D68: ExportTable_Address | E68: 0
A69: =R[-1]C+R[-1]C[1] -> 4 | B69: 4 | C69: int | D69: ExportTable_Size | E69: 0
A70: =R[-1]C+R[-1]C[1] -> 8 | B70: 4 | C70: int | D70: ImportTable_Address | E70: 0 | F70: 設定必要
A71: =R[-1]C+R[-1]C[1] -> 12 | B71: 4 | C71: int | D71: ImportTable_Size | E71: 0 | F71: 設定必要
A72: =R[-1]C+R[-1]C[1] -> 16 | B72: 4 | C72: int | D72: ResourceTable_Address | E72: 0
A73: =R[-1]C+R[-1]C[1] -> 20 | B73: 4 | C73: int | D73: ResourceTable_Size | E73: 0
A74: =R[-1]C+R[-1]C[1] -> 24 | B74: 4 | C74: int | D74: ExceptionTable_Address | E74: 0
A75: =R[-1]C+R[-1]C[1] -> 28 | B75: 4 | C75: int | D75: ExceptionTable_Size | E75: 0
A76: =R[-1]C+R[-1]C[1] -> 32 | B76: 4 | C76: int | D76: CertificateTable_Address | E76: 0
A77: =R[-1]C+R[-1]C[1] -> 36 | B77: 4 | C77: int | D77: CertificateTable_Size | E77: 0
A78: =R[-1]C+R[-1]C[1] -> 40 | B78: 4 | C78: int | D78: BaseRelocationTable_Address | E78: 0
A79: =R[-1]C+R[-1]C[1] -> 44 | B79: 4 | C79: int | D79: BaseRelocationTable_Size | E79: 0
A80: =R[-1]C+R[-1]C[1] -> 48 | B80: 4 | C80: int | D80: Debug_Address | E80: 0
A81: =R[-1]C+R[-1]C[1] -> 52 | B81: 4 | C81: int | D81: Debug_Size | E81: 0
A82: =R[-1]C+R[-1]C[1] -> 56 | B82: 4 | C82: int | D82: Copyright_Address | E82: 0
A83: =R[-1]C+R[-1]C[1] -> 60 | B83: 4 | C83: int | D83: Copyright_Size | E83: 0
A84: =R[-1]C+R[-1]C[1] -> 64 | B84: 4 | C84: int | D84: GlobalPtr_Address | E84: 0
A85: =R[-1]C+R[-1]C[1] -> 68 | B85: 4 | C85: int | D85: GlobalPtr_Size | E85: 0
A86: =R[-1]C+R[-1]C[1] -> 72 | B86: 4 | C86: int | D86: TLSTable_Address | E86: 0
A87: =R[-1]C+R[-1]C[1] -> 76 | B87: 4 | C87: int | D87: TLSTable_Size | E87: 0
A88: =R[-1]C+R[-1]C[1] -> 80 | B88: 4 | C88: int | D88: LoadConfigTable_Address | E88: 0
A89: =R[-1]C+R[-1]C[1] -> 84 | B89: 4 | C89: int | D89: LoadConfigTable_Size | E89: 0
A90: =R[-1]C+R[-1]C[1] -> 88 | B90: 4 | C90: int | D90: BoundImport_Address | E90: 0
A91: =R[-1]C+R[-1]C[1] -> 92 | B91: 4 | C91: int | D91: BoundImport_Size | E91: 0
A92: =R[-1]C+R[-1]C[1] -> 96 | B92: 4 | C92: int | D92: IAT_Address | E92: 0
A93: =R[-1]C+R[-1]C[1] -> 100 | B93: 4 | C93: int | D93: IAT_Size | E93: 0
A94: =R[-1]C+R[-1]C[1] -> 104 | B94: 4 | C94: int | D94: DelayImportDescriptor_Address | E94: 0
A95: =R[-1]C+R[-1]C[1] -> 108 | B95: 4 | C95: int | D95: DelayImportDescriptor_Size | E95: 0
A96: =R[-1]C+R[-1]C[1] -> 112 | B96: 4 | C96: int | D96: CLIHeader_Address | E96: 0
A97: =R[-1]C+R[-1]C[1] -> 116 | B97: 4 | C97: int | D97: CLIHeader_Size | E97: 0
A98: =R[-1]C+R[-1]C[1] -> 120 | B98: 4 | C98: int | D98: Reserved_Address | E98: 0
A99: =R[-1]C+R[-1]C[1] -> 124 | B99: 4 | C99: int | D99: Reserved_Size | E99: 0
A100: =R[-1]C+R[-1]C[1] -> 128
C102: struct | D102: SectionHeader
A103: =R[-1]C+R[-1]C[1] -> 0 | B103: 8 | C103: byte | D103: name[8] | F103: 設定必要
A104: =R[-1]C+R[-1]C[1] -> 8 | B104: 4 | C104: int | D104: VirtualSize | E104: 0 | F104: 設定必要
A105: =R[-1]C+R[-1]C[1] -> 12 | B105: 4 | C105: int | D105: VirtualAddress | E105: 0 | F105: 設定必要
A106: =R[-1]C+R[-1]C[1] -> 16 | B106: 4 | C106: int | D106: SizeOfRawData | E106: 0 | F106: 設定必要
A107: =R[-1]C+R[-1]C[1] -> 20 | B107: 4 | C107: int | D107: PointerToRawData | E107: 0 | F107: 設定必要
A108: =R[-1]C+R[-1]C[1] -> 24 | B108: 4 | C108: int | D108: PointerToRelocations | E108: 0
A109: =R[-1]C+R[-1]C[1] -> 28 | B109: 4 | C109: int | D109: PointerToLinenumbers | E109: 0
A110: =R[-1]C+R[-1]C[1] -> 32 | B110: 2 | C110: ushort | D110: NumberOfRelocations | E110: 0
A111: =R[-1]C+R[-1]C[1] -> 34 | B111: 2 | C111: ushort | D111: NumberOfLinenumbers | E111: 0
A112: =R[-1]C+R[-1]C[1] -> 36 | B112: 4 | C112: int | D112: Characteristics | E112: 0 | F112: 設定必要
A113: =R[-1]C+R[-1]C[1] -> 40
C115: struct | D115: ImportTable
A116: =R[-1]C+R[-1]C[1] -> 0 | B116: 4 | C116: int | D116: ImportLookupTable | E116: 0 | F116: 設定必要
A117: =R[-1]C+R[-1]C[1] -> 4 | B117: 4 | C117: int | D117: DateTimeStamp | E117: 0 | F117: 設定することが望ましい
A118: =R[-1]C+R[-1]C[1] -> 8 | B118: 4 | C118: int | D118: ForwarderChain | E118: 0
A119: =R[-1]C+R[-1]C[1] -> 12 | B119: 4 | C119: int | D119: Name | E119: 0 | F119: 設定必要
A120: =R[-1]C+R[-1]C[1] -> 16 | B120: 4 | C120: int | D120: ImportAddressTable | E120: 0 | F120: 設定必要
A121: =R[-1]C+R[-1]C[1] -> 20
C123: struct | D123: ExportTable
A124: =R[-1]C+R[-1]C[1] -> 0 | B124: 4 | C124: int | D124: ExportFlags | E124: 0 | F124: 常に0
A125: =R[-1]C+R[-1]C[1] -> 4 | B125: 4 | C125: int | D125: TimeDateStamp | E125: 0 | F125: 設定することが望ましい
A126: =R[-1]C+R[-1]C[1] -> 8 | B126: 2 | C126: ushort | D126: MajorVersion | E126: 0
A127: =R[-1]C+R[-1]C[1] -> 10 | B127: 2 | C127: ushort | D127: MinorVersion | E127: 0
A128: =R[-1]C+R[-1]C[1] -> 12 | B128: 4 | C128: int | D128: Name | E128: 0 | F128: 設定必要
A129: =R[-1]C+R[-1]C[1] -> 16 | B129: 4 | C129: int | D129: OrdinalBase | E129: 1 | F129: 設定必要
A130: =R[-1]C+R[-1]C[1] -> 20 | B130: 4 | C130: int | D130: AddressTableEntries | E130: 0 | F130: 設定必要
A131: =R[-1]C+R[-1]C[1] -> 24 | B131: 4 | C131: int | D131: NumberOfNamePointers | E131: 0 | F131: 設定必要
A132: =R[-1]C+R[-1]C[1] -> 28 | B132: 4 | C132: int | D132: ExportAddressTable | E132: 0 | F132: 設定必要
A133: =R[-1]C+R[-1]C[1] -> 32 | B133: 4 | C133: int | D133: NamePointer | E133: 0 | F133: 設定必要
A134: =R[-1]C+R[-1]C[1] -> 36 | B134: 4 | C134: int | D134: OrdinalTable | E134: 0 | F134: 設定必要
A135: =R[-1]C+R[-1]C[1] -> 40
C137: struct | D137: FixupHeader
A138: =R[-1]C+R[-1]C[1] -> 0 | B138: 4 | C138: int | D138: Page | E138: 0 | F138: 設定必要
A139: =R[-1]C+R[-1]C[1] -> 4 | B139: 4 | C139: int | D139: BlockSize | E139: 0 | F139: 設定必要
A140: =R[-1]C+R[-1]C[1] -> 8